[
  {
    "id": "20202020-2020-4202-8202-202020202020",
    "siteId": "11111111-1111-4111-8111-111111111111",
    "stockItemId": "19191919-1919-4191-8191-191919191919",
    "operationId": "14141414-1414-4141-8141-141414141414",
    "lotId": "66666666-6666-4666-8666-666666666666",
    "tankId": "33333333-3333-4333-8333-333333333333",
    "direction": "out",
    "quantity": 1,
    "unit": "l",
    "reason": "Correction SO2",
    "movedAt": "2026-05-18T09:00:00.000Z",
    "actorId": "aaaaaaaa-aaaa-4aaa-8aaa-aaaaaaaaaaaa",
    "createdAt": "2026-05-18T09:00:00.000Z",
    "updatedAt": "2026-05-18T09:00:00.000Z"
  }
]
